Title,Company,Location,Stipend,Date,Skills,Link
Software Development Engineering (Web),Pulse Pharmaceuticals,Hyderabad,"₹ 10,000 - 15,000 /month",3 weeks ago,"CSS, HTML, JavaScript, MySQL, Python",https://internshala.com/internship/detail/software-development-engineering-web-internship-in-hyderabad-at-pulse-pharmaceuticals1743162948
"Software Development Engineer I, Amazon University Talent Acquisition",Amazon,"Chennai, Delhi, Bengaluru",Not provided,3 weeks agoBe an early applicant,"Algorithms, Analytical Thinking, C++ Programming, C Programming, Data Structures, Effective Communication, Java, Perl, Problem Solving, Python",https://internshala.com/internship/detail/software-development-engineer-i-amazon-university-talent-acquisition-internship-in-multiple-locations-at-amazon1743233303
Software Development Engineer I – Amazon University Talent Acquisition,Amazon,Bengaluru,Not provided,3 weeks agoBe an early applicant,"Algorithms, Analytical Thinking, C++ Programming, Collaboration, C Programming, Data Structures, Effective Communication, Java, Perl, Problem Solving, Python",https://internshala.com/internship/detail/software-development-engineer-i--amazon-university-talent-acquisition-internship-in-bangalore-at-amazon1743231821
"Software Development Engineer I, Amazon University Talent Acquisition",Amazon,Bengaluru,Not provided,3 weeks agoBe an early applicant,"Algorithms, Analytical Thinking, C++ Programming, C Programming, Data Structures, Effective Communication, Java, Perl, Problem Solving, Python",https://internshala.com/internship/detail/software-development-engineer-i-amazon-university-talent-acquisition-internship-in-bangalore-at-amazon1743165886
Junior Data Scientist For High-Growth Web3  Trading Platform,Primetrade.ai,Work from home,"₹ 10,000 - 15,000 /month",Just now,"Cryptography, NumPy, Pandas, Python, Seaborn, Statistics, Stock Trading, Time Management, web3.js",https://internshala.com/internship/detail/work-from-home-junior-data-scientist-for-high-growth-web3-trading-platform-internship-at-primetradeai1747023538
Python Developer (Serverless),Across The Globe (ATG),Work from home,"₹ 2,500 - 5,000 /month",Just nowPart time,"Django, MS SQL Server, Python",https://internshala.com/internship/detail/work-from-home-part-time-python-developer-serverless-internship-at-across-the-globe-atg1747023806
AI Agent Making,International Institute Of SDGs & Public Policy Research,Work from home,Unpaid,Just nowPart time,Python,https://internshala.com/internship/detail/work-from-home-part-time-ai-agent-making-internship-at-international-institute-of-sdgs-public-policy-research1747023237
Junior Python Developer For Crypto Trading Bot,Primetrade.ai,Work from home,"₹ 10,000 - 15,000 /month",Just now,"Clinical Data Management, Cryptography, Python, REST API, Stock Trading",https://internshala.com/internship/detail/work-from-home-junior-python-developer-for-crypto-trading-bot-internship-at-primetradeai1747023327
Operations,MiStay,Bangalore(Hybrid),"₹ 8,000 - 10,000 /month",4 days agoBe an early applicant,"Django, English Proficiency (Spoken), English Proficiency (Written), MS-Excel",https://internshala.com/internship/detail/operations-internship-in-bangalore-at-mistay1746602000
UrbanTech Operations,Arealis Networks Pvt. Ltd.,Pune(Hybrid),"₹ 3,000 - 5,000 /month",3 days agoPart time,"Big Data Analytics, Matplotlib, NumPy, Python, PyTorch, scikit-learn, TensorFlow",https://internshala.com/internship/detail/part-time-urbantech-operations-internship-in-pune-at-arealis-networks-pvt-ltd1746686551
Not Available,Not Available,Not Available,Not Available,Not Available,Not Available,
Convolutional Neural Network(CNN),International Institute Of SDGs & Public Policy Research,Work from home,Unpaid,Just nowBe an early applicantPart time,Python,https://internshala.com/internship/detail/work-from-home-part-time-convolutional-neural-networkcnn-internship-at-international-institute-of-sdgs-public-policy-research1747026838
Web Scrapping,International Institute Of SDGs & Public Policy Research,Work from home,Unpaid,Just nowBe an early applicant,Python,https://internshala.com/internship/detail/work-from-home-web-scrapping-internship-at-international-institute-of-sdgs-public-policy-research1747025802
Teaching,The Education Diary,Work from home,"₹ 5,000 - 7,000 /month",Just nowBe an early applicant,"Digital Marketing, English Proficiency (Spoken), English Proficiency (Written), Hindi Proficiency (Spoken), Java, Online Teaching, Python, Teaching, Web development, WordPress",https://internshala.com/internship/detail/work-from-home-teaching-internship-at-the-education-diary1747025734
Machine Learning,Jivichem Synthesis Private Limited,Work from home,"₹ 25,000 /month",Just nowPart time,"Artificial intelligence, Data Analytics, Data Science, Deep Learning, Machine Learning, Natural Language Processing (NLP), Python, R Programming",https://internshala.com/internship/detail/work-from-home-part-time-machine-learning-internship-at-jivichem-synthesis-private-limited1747025266
Artificial Intelligence (AI),Nimrobo AI Pvt Ltd,Work from home,"₹ 6,000 - 9,000 /month",Just now,"Artificial intelligence, Data Structures, Deep Learning, JavaScript, Python, React",https://internshala.com/internship/detail/work-from-home-artificial-intelligence-ai-internship-at-nimrobo-ai-pvt-ltd1747024554
Full Stack Development,Sports Aid,Work from home,"₹ 35,000 - 45,000 /month",Just now,"JavaScript, Python, Swift",https://internshala.com/internship/detail/work-from-home-full-stack-development-internship-at-fateh-singh-aurora1747023263
Artificial Intelligence (AI),CollegeTips Ed Tech Media Private Limited,Work from home,"₹ 10,000 - 25,000 /month",Few hours agoJob offer upto₹ 6LPApost internshipPart time,"Artificial intelligence, Machine Learning, Python",https://internshala.com/internship/detail/work-from-home-part-time-artificial-intelligence-ai-internship-at-collegetips-ed-tech-media-private-limited1746988162
Software Development Engineering (Web),Ghackk Technologies,Work from home,"₹ 1,000 /month",Today,"CSS, HTML, JavaScript, jQuery, MySQL, Next.js, Node.js, PHP, Python, React",https://internshala.com/internship/detail/work-from-home-software-development-engineering-web-internship-at-ghackk-technologies1746966629
Software Development Engineering (Web),Ghackk Technologies,Bhagalpur,"₹ 2,000 /month",Today,"CSS, HTML, JavaScript, jQuery, MySQL, Next.js, Node.js, PHP, Python, React",https://internshala.com/internship/detail/software-development-engineering-web-internship-in-bhagalpur-at-ghackk-technologies1746964883
Internet Of Things (IoT),Techiesms,Ahmedabad,"₹ 4,000 - 5,000 /month",TodayPart time,"Arduino, C++ Programming, C Programming, Embedded Systems, Internet of Things (IoT), Machine Learning, PCB Soldering, Python, Raspberry Pi",https://internshala.com/internship/detail/part-time-internet-of-things-iot-internship-in-ahmedabad-at-techiesms1746943309
Machine Learning,Maxgen Technologies Private Limited,Ahmedabad,"₹ 7,000 - 12,000 /month",1 day ago,"Artificial intelligence, Machine Learning, Python",https://internshala.com/internship/detail/machine-learning-internship-in-ahmedabad-at-maxgen-technologies-private-limited1746930358
Python Development,Aadhvik Technologies,Work from home,"₹ 1,000 - 2,000 /month",2 days agoPart time,Python,https://internshala.com/internship/detail/work-from-home-part-time-python-development-internship-at-aadhvik-technologies1746857183
Data Analytics,Water Town Swim School,Work from home,"₹ 20,000 - 40,000 /month",2 days ago,"Algorithms, Amazon Web Services (AWS), Analytical Thinking, AWS CloudFormation, Cloud Computing, Critical thinking, Data Analysis, Data Analytics, Database Management System (DBMS), Database Testing, Google Analytics, HTML, Microsoft Azure, MS SQL Server, Power BI, Problem Solving, Python, Search Engine Optimization (SEO), SQL, Tableau",https://internshala.com/internship/detail/work-from-home-data-analytics-internship-at-water-town-swim-school1746851980
Business Analytics,Snapmint Credit Advisory Private Limited,Bangalore,"₹ 30,000 - 40,000 /month",2 days ago,"MS-Excel, Python, SQL",https://internshala.com/internship/detail/business-analytics-internship-in-bangalore-at-snapmint-credit-advisory-private-limited1746795400
Data Analytics,Kkonnect.io,Bangalore,"₹ 10,000 - 15,000 /month",2 days ago,"Data Analytics, Data Science, Data Visualization, Machine Learning, MS-Excel, Power BI, Python, SQL, Tableau",https://internshala.com/internship/detail/data-analytics-internship-in-bangalore-at-kkonnectio1746791240
Backend Development,Whatbytes,Work from home,"₹ 10,000 - 20,000 /month",2 days ago,"Data Structures, Django, PostgreSQL, Python, REST API",https://internshala.com/internship/detail/work-from-home-backend-development-internship-at-whatbytes1746786209
Artificial Intelligence (AI),Jivichem Synthesis Private Limited,Work from home,"₹ 22,000 /month",2 days ago,"Artificial intelligence, Data Science, Data Structures, Deep Learning, Machine Learning, Natural Language Processing (NLP), Neural Networks, Python",https://internshala.com/internship/detail/work-from-home-artificial-intelligence-ai-internship-at-jivichem-synthesis-private-limited1746784955
Data Science,Jivichem Synthesis Private Limited,Work from home,"₹ 22,000 /month",2 days agoPart time,"Artificial intelligence, Data Analytics, Data Science, Deep Learning, Machine Learning, Natural Language Processing (NLP), Python, SQL",https://internshala.com/internship/detail/work-from-home-part-time-data-science-internship-at-jivichem-synthesis-private-limited1746783022
Software Developer – AI Agent Systems,Pehchaan AI Technologies,Work from home,"₹ 10,000 - 15,000 /month",2 days ago,"APIs, Artificial intelligence, LangChain, LLM evaluation, Python",https://internshala.com/internship/detail/work-from-home-software-developer--ai-agent-systems-internship-at-pehchaan-ai-technologies1746779857
Software Development,StoryMirror Infotech Private Limited,Mumbai,"₹ 10,000 - 40,000 /month",2 days ago,"Artificial intelligence, HTML, JavaScript, Python",https://internshala.com/internship/detail/software-development-internship-in-mumbai-at-storymirror-infotech-private-limited1746776241
Machine Learning,MentorBoxx,Work from home,"₹ 10,000 /month",2 days agoPart time,"Data Analytics, Machine Learning, Natural Language Processing (NLP), Python",https://internshala.com/internship/detail/work-from-home-part-time-machine-learning-internship-at-mentorboxx1746775817
Data Science,MentorBoxx,Work from home,"₹ 10,000 /month",2 days agoPart time,"Data Analytics, Data Science, Deep Learning, Machine Learning, Natural Language Processing (NLP), Python, SQL",https://internshala.com/internship/detail/work-from-home-part-time-data-science-internship-at-mentorboxx1746775531
Software Development,Blaziken Technologies Private Limited,Mumbai,"₹ 5,000 - 10,000 /month",2 days ago,"CSS, HTML, JavaScript, Python, React Native",https://internshala.com/internship/detail/software-development-internship-in-mumbai-at-blaziken-technologies-private-limited1746772278
Node.js Development,Warewe Consultancy Private Limited,Gurgaon,"₹ 10,000 - 15,000 /month",3 days ago,"Amazon Web Services (AWS), Express.js, JavaScript, Node.js, Python, Redux, REST API",https://internshala.com/internship/detail/nodejs-development-internship-in-gurgaon-at-warewe-consultancy-private-limited1746771014
Integration Specialist,Talent Corner HR Services,Mumbai,"₹ 15,000 lump sum",3 days ago,"Effective Communication, JavaScript, Microsoft Azure, Python, Requirements Gathering, Swagger",https://internshala.com/internship/detail/integration-specialist-internship-in-mumbai-at-talent-corner-hr-services1746766424
Automation Specialist,Talent Corner HR Services,Mumbai,"₹ 15,000 lump sum",3 days ago,"Amazon Web Services (AWS), JavaScript, Powershell, Problem Solving, Python, Robotic Process Automation (RPA), SQL",https://internshala.com/internship/detail/automation-specialist-internship-in-mumbai-at-talent-corner-hr-services1746766338
IT Internship,Fuel It Online,"Delhi, Indore, Jodhpur, Kanpur, Kolkata, Lucknow, Patna, Udaipur, Mumbai, Varanasi, Jaipur, Noida, Bangalore, Prayagraj Sub-District(Hybrid)","₹ 2,000 - 10,000 /month",3 days ago,"Android, JavaScript, MEAN, MERN, Python, Web development",https://internshala.com/internship/detail/it-internship-internship-in-multiple-locations-at-fuel-it-online1746762129
Machine Learning,NDFM Business World Pvt. Ltd.,Work from home,"₹ 5,000 - 7,000 /month",3 days agoJob offer upto₹ 10LPApost internship,"Artificial intelligence, Data Science, Machine Learning, Python",https://internshala.com/internship/detail/work-from-home-machine-learning-internship-at-ndfm-business-world-pvt-ltd1746705234
AWS DevOps Engineer,IESoft Technologies Private Limited,Mumbai,"₹ 20,000 - 2,50,000 /month",3 days agoJob offer upto₹ 5LPApost internship,"Amazon Web Services (AWS), Computer Networking, DevOps, JavaScript, Linux, Python, Shell Scripting",https://internshala.com/internship/detail/aws-devops-engineer-internship-in-mumbai-at-iesoft-technologies-private-limited1746698891
Automation Engineering – POS & Inventory Management Systems,Schoolato,Gurgaon,"₹ 3,000 - 6,000 /month",3 days ago,"Java, Python",https://internshala.com/internship/detail/automation-engineering--pos-inventory-management-systems-internship-in-gurgaon-at-schoolato1746698481
Full Stack Development,Ridvig Technologies,Work from home,"₹ 1,000 /month",3 days ago,"CSS, Django, Docker, HTML, JavaScript, jQuery, MySQL, React",https://internshala.com/internship/detail/work-from-home-full-stack-development-internship-at-ridvig-technologies1746697155
Software Development Engineering (Web),Metagauss,Jaipur,"₹ 7,000 - 8,000 /month",3 days ago,"HTML, Java, jQuery, MySQL, PHP, Python",https://internshala.com/internship/detail/software-development-engineering-web-internship-in-jaipur-at-metagauss1746689711
Data Engineer,Talent Corner HR Services,Mumbai,"₹ 15,000 lump sum",3 days ago,"Amazon Web Services (AWS), Data Warehousing, Effective Communication, Microsoft Azure, Problem Solving, Python, SQL",https://internshala.com/internship/detail/data-engineer-internship-in-mumbai-at-talent-corner-hr-services1746694086
Technical,Nurture Xcel,Mumbai,"₹ 5,000 - 7,000 /month",3 days ago,"Computer skills, Java, JavaScript, Problem Solving, Python, Troubleshooting",https://internshala.com/internship/detail/technical-internship-in-mumbai-at-nurture-xcel1746693560
Cybersecurity Analyst,Talent Corner HR Services,Mumbai,"₹ 15,000 lump sum",3 days ago,"Bash, Collaboration, Effective Communication, OpenVAS, Python, Security tools",https://internshala.com/internship/detail/cybersecurity-analyst-internship-in-mumbai-at-talent-corner-hr-services1746693396
Campus Ambassador,NFThing,Work from home,Performance Based,3 days agoPart time,"Analytical Thinking, Critical thinking, Effective Communication, English Proficiency (Spoken), English Proficiency (Written), Interpersonal skills, Node.js, Problem Solving, Python, Social Media Marketing",https://internshala.com/internship/detail/campus-ambassador-programme-at-nfthing1746691384
Artificial Intelligence (AI),Settyl,Chennai,"₹ 12,000 - 15,000 /month",3 days ago,"Artificial intelligence, Data Analytics, Data Science, Deep Learning, FastAPI, Flask, Gemini, Generative AI Development, Generative AI Tools, Google Cloud Platforms (GCP), LLM evaluation, Machine Learning, Microsoft Azure, Python",https://internshala.com/internship/detail/artificial-intelligence-ai-internship-in-chennai-at-settyl1746690205
Full Stack Developer,Talent Corner HR Services,Mumbai,"₹ 15,000 lump sum",3 days ago,"AngularJS, HTML, JavaScript, MySQL, Node.js, Python, React",https://internshala.com/internship/detail/full-stack-developer-internship-in-mumbai-at-talent-corner-hr-services1746689769
Data Analyst,Talent Corner HR Services,Mumbai,"₹ 15,000 lump sum",3 days ago,"Hypothesis Testing, Jupyter Notebook, MS-Excel, Power BI, Python, SQL, Tableau",https://internshala.com/internship/detail/data-analyst-internship-in-mumbai-at-talent-corner-hr-services1746688355
Artificial Intelligence (AI),HeyCloudy,Work from home,"₹ 2,000 /month",3 days agoPart time,"Artificial intelligence, Data Science, Data Structures, Python",https://internshala.com/internship/detail/work-from-home-part-time-artificial-intelligence-ai-internship-at-heycloudy1746688226
Not Available,Not Available,Not Available,Not Available,Not Available,Not Available,
Business Strategy Analyst,Faclon,Mumbai,"₹ 7,000 - 12,000 /month",3 days ago,"MS-Office, Power BI, Python, SQL, Tableau",https://internshala.com/internship/detail/business-strategy-analyst-internship-in-mumbai-at-faclon1746687099
Software Development,Amber Flux Private Limited,Work from home,"₹ 9,999 - 10,000 /month",4 days agoPart time,"Apache Cassandra, C++ Programming, Context API, CSS, FastAPI, Git, MEAN, MERN, Next.js, Python, Redux, REST API, Shadcn, SQL, Tailwind CSS, TypeScript",https://internshala.com/internship/detail/work-from-home-part-time-software-development-internship-at-amber-flux-private-limited1746682456
GLSL Shaders Developer,WebTree Global Private Limited,Work from home,"₹ 1,001 - 7,000 /month",4 days ago,"Blender 3D, Python",https://internshala.com/internship/detail/work-from-home-glsl-shaders-developer-internship-at-webtree-global-private-limited1746681493
GenAI/LLM,Resolute AI Software Private Limited,Work from home,"₹ 5,000 - 8,000 /month",4 days ago,"Amazon Web Services (AWS), Artificial intelligence, C++ Programming, Google Cloud Platforms (GCP), Java, Machine Learning, Microsoft Azure, Python, TensorFlow",https://internshala.com/internship/detail/work-from-home-genai-llm-internship-at-resolute-ai-software-private-limited1746679970
Game Analyst,Underpin Services,"Delhi, Noida","₹ 15,000 /month",4 days ago,"Git, GitHub, JavaScript, Machine Learning, Python",https://internshala.com/internship/detail/game-analyst-internship-in-multiple-locations-at-underpin-services1746678400
Full Stack Development,Deepnexus S,Work from home,"₹ 17,000 - 23,000 /month",4 days ago,"HTML, JavaScript, Python",https://internshala.com/internship/detail/work-from-home-full-stack-development-internship-at-deepnexus-s1746624088
Automation Engineer,Spiritual Sutra Pvt. Ltd,Mumbai,"₹ 10,000 /month",4 days ago,"Automation, AWS Lambda, JavaScript, Python, Scheduling, Script Writing",https://internshala.com/internship/detail/automation-engineer-internship-in-mumbai-at-spiritual-sutra-pvt-ltd1746621124
Software Development,The Future University,"Chandigarh, Mohali","₹ 15,000 - 20,000 /month",4 days agoJob offer upto₹ 11LPApost internship,"HTML, JavaScript, Python",https://internshala.com/internship/detail/software-development-internship-in-multiple-locations-at-the-future-university1746619201
Artificial Neural Networks,Amart Global,Work from home,Unpaid,4 days agoPart time,"Artificial intelligence, Data Science, Deep Learning, Machine Learning, Natural Language Processing (NLP), Neural Networks, Prompt Engineering, Python",https://internshala.com/internship/detail/work-from-home-part-time-artificial-neural-networks-internship-at-amart-global1746611081
Zoho Developer,ZoChord,Gurgaon,"₹ 2,000 /month",4 days agoJob offer upto₹ 3LPApost internship,"Algorithms, Analytical Thinking, C++ Programming, C Programming, Critical thinking, CSS, Data Structures, Debugging, HTML, Java, JavaScript, MySQL, Object Oriented Programming (OOP), Problem Solving, Python",https://internshala.com/internship/detail/zoho-developer-internship-in-gurgaon-at-zochord1746610064
Software Development  (Python/Django + React),Senso Vision System,Bangalore,"₹ 5,000 - 10,000 /month",4 days ago,"Django, Python, React",https://internshala.com/internship/detail/software-development-python-django-react-internship-in-bangalore-at-senso-vision-system1746608750
Full Stack Development,Vanuston Intelligence Pvt Ltd,Chennai,"₹ 5,000 - 6,000 /month",4 days agoJob offer upto₹ 2.4LPApost internship,"Bootstrap, CSS3, HTML 5, Java, JavaScript, JSON, MySQL, Python",https://internshala.com/internship/detail/full-stack-development-internship-in-chennai-at-vanuston-intelligence-pvt-ltd1746605389
Full Stack AI Engineer - Intern,AffinityAnswers,Work from home,"₹ 30,000 - 35,000 /month",5 days ago,"Java, Linux, Python, Shell Scripting, SQL, Unix",https://internshala.com/internship/detail/work-from-home-full-stack-ai-engineer-intern-internship-at-affinityanswers1746598990
Internet Of Things (IoT),Olus Infomatics,Gurgaon,"₹ 12,000 /month",5 days ago,"C++ Programming, Embedded Systems, Internet of Things (IoT), Python",https://internshala.com/internship/detail/internet-of-things-iot-internship-in-gurgaon-at-olus-infomatics1746594187
Full Stack Development,Maxgen Technologies Private Limited,Pune,"₹ 7,000 - 12,000 /month",5 days ago,"Java, MongoDB, Node.js, Python, React",https://internshala.com/internship/detail/full-stack-development-internship-in-pune-at-maxgen-technologies-private-limited1746584674
Full Stack Development,Louder World,Delhi,"₹ 8,000 - 12,000 /month",5 days ago,"AngularJS, Claude, CSS, Generative AI Tools, GitHub Copilot (GenAI), HTML, JavaScript, MongoDB, MySQL, Node.js, PHP, Python, React",https://internshala.com/internship/detail/full-stack-development-internship-in-delhi-at-louder-world1746536303
Data Analytics,Kyaneos Technologies Private Limited,Work from home,"₹ 20,000 - 25,001 /month",5 days agoJob offer upto₹ 4.5LPApost internship,"Data Analytics, Data Science, MS-Excel, Power BI, Python, SQL",https://internshala.com/internship/detail/work-from-home-data-analytics-internship-at-kyaneos-technologies-private-limited1746535835
Data Analyst,Khilonamart,Indore(Hybrid),"₹ 4,000 - 7,000 /month",5 days ago,"Data Analysis, Data Analytics, Data Cleaning, Process Management, Python, Report Generation, SQL",https://internshala.com/internship/detail/data-analyst-internship-in-indore-at-khilonamart1746529755
Python Development,iTech Mission Private Limited,"Delhi, Gurgaon, Noida","₹ 15,000 /month",5 days agoJob offer starting₹ 5LPApost internship,"Big Data Analytics, CSS, Data Science, Django, Flask, HTML, Machine Learning, Python, REST API",https://internshala.com/internship/detail/python-development-internship-in-multiple-locations-at-itech-mission-private-limited1746529081
MCQ Problem Setter,Cognitio Eduventures Private Limited,Work from home,"₹ 14,500 - 15,000 /month",5 days agoPart time,"Algorithms, CSS, Data Structures, HTML, Python",https://internshala.com/internship/detail/work-from-home-part-time-mcq-problem-setter-internship-at-cognitio-eduventures-private-limited1746519174
Data Engineering,WiseAnalytics,Bangalore,"₹ 2,000 - 20,000 /month",5 days ago,"Apache Kafka, Apache Spark, Docker, Kubernetes, PySpark, Python, Snowflake, SQL, Terraform",https://internshala.com/internship/detail/data-engineering-internship-in-bangalore-at-wiseanalytics1746515183
Data Analytics,WiseAnalytics,Bangalore,"₹ 2,000 - 20,000 /month",5 days ago,"Google Sheets, Looker Studio, MS-Excel, NumPy, Power Query, PySpark, Python, SAS, SQL, STATA",https://internshala.com/internship/detail/data-analytics-internship-in-bangalore-at-wiseanalytics1746512943
Content Writing,Mem0 AI,Work from home,"₹ 20,000 - 30,000 /month",6 days agoPart time,"English Proficiency (Written), Python",https://internshala.com/internship/detail/work-from-home-part-time-content-writing-internship-at-mem0-ai1746510977
Automation - Supply Chain,Heavenly Secrets Private Limited,Mumbai,"₹ 15,000 /month",6 days ago,"Data Analytics, JavaScript, Looker Studio, Python, React, SQL",https://internshala.com/internship/detail/automation-supply-chain-internship-in-mumbai-at-heavenly-secrets-private-limited1746508275
Full Stack Development,Digite Infotech Private Limited,Bangalore,"₹ 15,000 - 20,000 /month",6 days ago,"FastAPI, MongoDB, Python, React, React Native",https://internshala.com/internship/detail/full-stack-development-internship-in-bangalore-at-digite-infotech-private-limited1746508205
Internet Of Things (IoT),TringBox,Work from home,"₹ 4,000 - 15,000 /month",6 days agoJob offer upto₹ 7LPApost internshipPart time,"Arduino, ARM Microcontroller, C++ Programming, Circuit Design, C Programming, Embedded Systems, ESP32, Internet of Things (IoT), Python, Raspberry Pi",https://internshala.com/internship/detail/work-from-home-part-time-internet-of-things-iot-internship-at-tringbox1746506792
Data Visualisation,WiseAnalytics,Bangalore,"₹ 2,000 - 20,000 /month",6 days ago,"Looker Studio, Matplotlib, Plotly, Power BI, PySpark, Python, Seaborn, SQL, Streamlit, Tableau",https://internshala.com/internship/detail/data-visualisation-internship-in-bangalore-at-wiseanalytics1746505617
Artificial Intelligence (AI),Step Consultancy,Work from home,"₹ 10,000 - 20,000 /month",6 days agoJob offer upto₹ 10LPApost internship,"Artificial intelligence, Data Science, Data Structures, Machine Learning, Python, React",https://internshala.com/internship/detail/work-from-home-artificial-intelligence-ai-internship-at-step-consultancy1746505395
Blockchain Development,Buddha Education Association Incorporation,Work from home,"₹ 10,000 /month",6 days agoJob offer upto₹ 11LPApost internship,"Blockchain, C++ Programming, Ethereum, Hyperledger, Java, JavaScript, Node.js, Python, React",https://internshala.com/internship/detail/work-from-home-blockchain-development-internship-at-buddha-education-association-incorporation1746450805
Artificial Intelligence (AI),Buddha Education Association Incorporation,Work from home,"₹ 10,000 /month",6 days ago,"Data Science, Data Structures, Python",https://internshala.com/internship/detail/work-from-home-artificial-intelligence-ai-internship-at-buddha-education-association-incorporation1746450702
